{
  "$schema": "https://example.invalid/ai-migration-framework/schemas/profile.schema.json",
  "schema_version": "2.0",
  "profile_version": "1.0.0",
  "kind": "source",
  "id": "sample-source",
  "display_name": "Sample source",
  "capabilities": ["source-detection", "behavior-characterization", "ownership-analysis"],
  "documents": ["docs/standards/sources/_template/README.md"],
  "variables": {
    "source_language": "Sample Source",
    "source_language_id": "sample-source",
    "source_extensions": ".sample",
    "source_extensions_glob": "*.sample",
    "source_test_extensions": "*_test.sample",
    "source_build_systems": "SampleBuild",
    "source_package_managers": "SamplePackages",
    "source_test_frameworks": "SampleTest",
    "source_include_directive": "import",
    "source_namespace_concept": "module"
  },
  "provenance": {"last_reviewed_version": "1.0.0", "evidence": ["Structural conformance fixture"]}
}
