{
  "$schema": "../../../../schemas/profile.schema.json",
  "schema_version": "2.0",
  "profile_version": "2.0.0",
  "kind": "output",
  "id": "service",
  "display_name": "Service",
  "capabilities": ["deployable-runtime", "network-boundaries", "modular-hexagonal"],
  "requires": {"target": ["architecture-validation", "dependency-integrity"]},
  "documents": ["docs/output-profiles/service.md"],
  "target_documents": {
    "java-25": ["docs/standards/targets/java-25/service-profile.md"]
  },
  "variables": {
    "output_profile": "service",
    "target_framework": "Spring Boot 4.x",
    "architecture_style": "modular-hexagonal"
  },
  "quality_gates": {
    "required": ["behavioral-contracts", "build", "tests", "architecture", "static-analysis", "dependency-integrity"],
    "human_approval": true,
    "coverage_policy": {"metric": "changed-code", "project_thresholds_required": true}
  },
  "provenance": {"last_reviewed_version": "2.0.0", "evidence": ["Ports and Adapters service boundary guidance"]}
}
