{
  "$schema": "../../../../schemas/profile.schema.json",
  "schema_version": "2.0",
  "profile_version": "2.0.0",
  "kind": "source",
  "id": "cpp",
  "display_name": "C++",
  "capabilities": [
    "source-detection",
    "build-variant-discovery",
    "behavior-characterization",
    "ownership-analysis",
    "native-boundary-analysis"
  ],
  "documents": [
    "docs/standards/sources/cpp/detection-rules.md",
    "docs/standards/sources/cpp/dependency-catalog.md",
    "docs/standards/sources/cpp/idioms.md",
    "docs/standards/sources/cpp/semantic-hazards.md",
    "docs/standards/sources/cpp/test-frameworks.md"
  ],
  "variables": {
    "source_language": "C++",
    "source_language_id": "cpp",
    "source_extensions": ".cpp, .cc, .cxx, .h, .hh, .hpp, .hxx, .ixx, .cppm",
    "source_extensions_glob": "*.cpp *.cc *.cxx *.h *.hh *.hpp *.hxx *.ixx *.cppm",
    "source_test_extensions": "*_test.cpp *_test.cc *_tests.cpp *Test.cpp",
    "source_build_systems": "CMake, Make, MSBuild, Meson, Bazel",
    "source_package_managers": "Conan, vcpkg",
    "source_test_frameworks": "GoogleTest, Catch2, doctest, Boost.Test",
    "source_include_directive": "#include",
    "source_namespace_concept": "namespace"
  },
  "provenance": {
    "last_reviewed_version": "2.0.0",
    "evidence": ["ISO C++ behavior categories and supported compiler documentation"]
  }
}
